{
  "schema_version": "1.0",
  "platform": "web",
  "case_id": "case-003",
  "findings": [
    {
      "schema_version": "1.0",
      "finding_id": "F-001",
      "platform": "web",
      "title": "로그인 실패 횟수 제한 미흡",
      "target": {
        "case_id": "case-003",
        "target_id": "TGT-001",
        "service_name": "Portal Service",
        "base_url": "https://portal.example.com",
        "target_url": "https://portal.example.com/login",
        "environment": "staging",
        "auth_context": "authenticated",
        "criticality": "high"
      },
      "source": {
        "tool": "HexStrike",
        "raw_file": "cases/web/case-003/input/findings/F-001/raw/hexstrike-result.json",
        "raw_file_sha256": "4846cb2438c5d8d92e56375f7229c57aae41f4eb943a48d0c7014a907a3c2680",
        "manual_finding_file": "cases/web/case-003/input/findings/F-001/manual-finding.yaml",
        "manual_finding_sha256": "b9938fab361c87e46e0c82dd13b26353557d6db3cee8c2c703c947852cac93f9",
        "parser": "web_hexstrike",
        "raw": {
          "tool": {
            "name": "HexStrike",
            "version": "2026.03"
          },
          "scan": {
            "scan_id": "scan-case-002-f001",
            "started_at": "2026-03-20T01:00:00Z"
          },
          "findings": [
            {
              "id": "HX-F001",
              "name": "Portal login brute force protection missing",
              "severity": "High",
              "endpoint": "https://portal.example.com/login",
              "path": "/login",
              "method": "POST",
              "parameter": null,
              "description": "Portal login endpoint accepted repeated failed login attempts without throttling.",
              "observation": "No CAPTCHA or account lockout was observed after repeated failures.",
              "impact": "Credential stuffing and account enumeration become feasible.",
              "remediation": [
                "Apply rate limiting",
                "Add CAPTCHA after repeated failures",
                "Review account lockout policy"
              ],
              "request": {
                "path": "/login",
                "content_type": "application/x-www-form-urlencoded"
              },
              "response": {
                "status_code": 200,
                "message": "Invalid username or password"
              },
              "confidence": "high"
            }
          ],
          "unparsed_root_field": "portal-preserve"
        }
      },
      "classification": {
        "taxonomy": {
          "name": "web-kisa-2026",
          "version": "2026"
        },
        "code": "AU",
        "title_ko": "자동화 공격",
        "severity": "high",
        "canonical_key": "automated_attack"
      },
      "summary": "로그인 실패 횟수 제한 또는 CAPTCHA가 없어 반복 요청이 가능함",
      "description": "포털 로그인 기능에서 반복 인증 시도 제한이 없어 자동화 공격이 가능합니다.\n\nPortal login endpoint accepted repeated failed login attempts without throttling.\n\nNo CAPTCHA or account lockout was observed after repeated failures.",
      "cause": "로그인 실패 횟수 제한과 CAPTCHA 정책이 부재합니다.\n\nNo CAPTCHA or account lockout was observed after repeated failures.",
      "affected": {
        "system_name": "Portal Service",
        "url": "https://portal.example.com/login",
        "method": "POST",
        "parameter": null
      },
      "evidence": {
        "request_file": "cases/web/case-003/input/findings/F-001/http/request.txt",
        "request_file_sha256": "82935aa6bc19d6c9ad05ff7c9441543892c4abecf017998d47607f75a3d2d3f2",
        "response_file": "cases/web/case-003/input/findings/F-001/http/response.txt",
        "response_file_sha256": "ba3b2d9eb043e28b28863de39f8b107ff6502e932dd9fda666a537d3b04c7e92",
        "screenshots": [
          {
            "file": "cases/web/case-003/input/findings/F-001/evidence/screenshot-01.png",
            "caption": "포털 로그인 반복 요청 화면",
            "sha256": "737238a1dfb461721c4e4f2c9dcf4fa25e01519bccd2feb9d8bea79f4c070e39"
          }
        ]
      },
      "reproduction": {
        "preconditions": [
          "인증 전 로그인 페이지 접근 가능"
        ],
        "steps": [
          "포털 로그인 페이지 접속",
          "동일 계정으로 반복 로그인 시도",
          "별도 차단이 없음을 확인"
        ],
        "request_summary": "POST /login HTTP/1.1 / Host: portal.example.com / Content-Type: application/x-www-form-urlencoded / Body: username=test@example.com&password=wrong-password",
        "response_summary": "HTTP/1.1 200 OK / Content-Type: application/json / Body: {\"message\":\"Invalid username or password\",\"captchaRequired\":false,\"lockout\":false}"
      },
      "impact": "계정 존재 여부 식별 및 무차별 대입 공격 가능",
      "risk": {
        "rationale": "인증 전 반복 요청 제한이 없어 자동화 공격 성공 가능성이 높습니다.",
        "difficulty": "낮음",
        "asset": "사용자 계정 및 인증 기능",
        "precondition": "로그인 페이지 공개 노출"
      },
      "remediation": {
        "summary": "로그인 실패 횟수 제한과 CAPTCHA를 적용합니다.",
        "actions": [
          "로그인 rate limit 적용",
          "CAPTCHA 적용",
          "계정 잠금 정책 검토"
        ],
        "short_term": [
          "로그인 rate limit 적용",
          "CAPTCHA 적용"
        ],
        "mid_term": [
          "계정 잠금 정책 검토"
        ],
        "long_term": []
      },
      "references": [
        "OWASP Automated Threats to Web Applications"
      ],
      "decision_basis": "반복 로그인 요청 시 lockout과 CAPTCHA가 동작하지 않음을 확인했습니다.",
      "exception_note": "",
      "false_positive": false,
      "status": "open",
      "owner": "Portal Team",
      "reviewer": "Example Reviewer",
      "due_date": "2026-03-27",
      "notes": "portal target finding",
      "unmapped_fields": {
        "root": {
          "unparsed_root_field": "portal-preserve"
        },
        "finding": {
          "confidence": "high"
        }
      },
      "review_key": "rk-8dbc9e44fc5e4261"
    },
    {
      "schema_version": "1.0",
      "finding_id": "F-002",
      "platform": "web",
      "title": "디버그 응답 정보 노출",
      "target": {
        "case_id": "case-003",
        "target_id": "TGT-001",
        "service_name": "Portal Service",
        "base_url": "https://portal.example.com",
        "target_url": "https://portal.example.com/debug",
        "environment": "staging",
        "auth_context": "authenticated",
        "criticality": "high"
      },
      "source": {
        "tool": "HexStrike",
        "raw_file": "cases/web/case-003/input/findings/F-002/raw/hexstrike-result.json",
        "raw_file_sha256": "8b3d5f9f63d16cecbd4be0b0488986febe79e6b067625bd10f379e190d550e91",
        "manual_finding_file": "cases/web/case-003/input/findings/F-002/manual-finding.yaml",
        "manual_finding_sha256": "dfd7a8a1725306b1f7ddbbf25b8dd642dfb5d3b26eb89426f6bdd36e57c21ff5",
        "parser": "web_hexstrike",
        "raw": {
          "tool": {
            "name": "HexStrike",
            "version": "2026.03"
          },
          "scan": {
            "scan_id": "scan-case-002-f002",
            "started_at": "2026-03-20T01:10:00Z"
          },
          "findings": [
            {
              "id": "HX-F002",
              "name": "Debug information disclosure",
              "severity": "Medium",
              "endpoint": "https://portal.example.com/debug",
              "path": "/debug",
              "method": "GET",
              "parameter": "debug",
              "description": "The debug endpoint exposed stack trace and internal file path information.",
              "observation": "Internal exception details were returned in the HTTP response body.",
              "impact": "Implementation details become visible to authenticated users.",
              "remediation": [
                "Disable debug output in production",
                "Use generic error responses"
              ],
              "request": {
                "path": "/debug",
                "content_type": "application/json"
              },
              "response": {
                "status_code": 500,
                "message": "Stack trace leaked"
              },
              "confidence": "medium"
            }
          ],
          "unparsed_root_field": "portal-debug-preserve"
        }
      },
      "classification": {
        "taxonomy": {
          "name": "web-kisa-2026",
          "version": "2026"
        },
        "code": "IL",
        "title_ko": "정보 누출",
        "severity": "medium",
        "canonical_key": "information_disclosure"
      },
      "summary": "오류 응답에 디버그 정보가 포함되어 내부 구현이 노출됨",
      "description": "포털 디버그 엔드포인트에서 내부 경로와 예외 메시지가 응답으로 노출됩니다.\n\nThe debug endpoint exposed stack trace and internal file path information.\n\nInternal exception details were returned in the HTTP response body.",
      "cause": "운영 차단이 필요한 디버그 기능이 외부에서 접근 가능합니다.\n\nInternal exception details were returned in the HTTP response body.",
      "affected": {
        "system_name": "Portal Service",
        "url": "https://portal.example.com/debug",
        "method": "GET",
        "parameter": "debug"
      },
      "evidence": {
        "request_file": "cases/web/case-003/input/findings/F-002/http/request.txt",
        "request_file_sha256": "a42d20ccdbd20f0a0678b6ad4aeb78b11f9f6f976080c253ff5765bbcfcbb924",
        "response_file": "cases/web/case-003/input/findings/F-002/http/response.txt",
        "response_file_sha256": "e4c628836dd50c67360e608e6db896c83d405e8ad0c99e35d4ef9fc912292f61",
        "screenshots": [
          {
            "file": "cases/web/case-003/input/findings/F-002/evidence/screenshot-01.png",
            "caption": "포털 디버그 정보 노출 화면",
            "sha256": "c36122c040f7bc2f061c06f12ec69311ea63bc3bb60864098eb4dfa354f51a01"
          }
        ]
      },
      "reproduction": {
        "preconditions": [
          "인증 후 디버그 페이지 접근 가능"
        ],
        "steps": [
          "디버그 엔드포인트 요청",
          "오류 조건 유발",
          "응답 내 내부 경로 및 예외 메시지 확인"
        ],
        "request_summary": "GET /debug?debug=true HTTP/1.1 / Host: portal.example.com",